{
  "$schema": "https://schemas.aramis.group/catalog/vehicle-multi-language-input.schema.json",
  "vin": "01234567891234567",
  "offerId": "111",
  "vehicleId": "111a",
  "offerType": "used",
  "status": "available",
  "originCountry": "ESP",
  "isMarketplace": false,
  "firstCirculationDate": "2010-20-10",
  "warrantyExpirationDate": "2010-20-10",
  "mileage": {"km": 12345},
  "euronorm": "6",
  "critair": null,
  "frenchFiscalPower": null,
  "frenchGenre": null,
  "belgianFiscalPower": 10,
  "belgianOtoto": { "url": "https://..." },
  "belgianCarpass": { "url": "https://..." },
  "catalogPriceWithOptionsWithTaxes": 10000,
  "takeoverPremium": -1500,
  "sellingPriceWithTaxes": 12300,
  "sellingPriceWithTakeoverWithTaxes": 0,
  "indicativeLoan": {"months": 72, "monthlyInstallment": 123},
  "maker": "SEAT",
  "model": "ARONA",
  "version": null,
  "engine": null,
  "finish": null,
  "manufacturerColor": { "en": "..." },
  "interior": { "en": "..." },
  "expertComments": {"en": "..."},
  "media": [{"type": "photo","url": "https://"}],
  "category":"convertible",
  "segment":"family",
  "energyType":"electric",
  "simpleColor":"grey",
  "simpleColor2":"blue",
  "interiorSimpleColor":"blue",
  "transmission":"automatic",
  "drive":"fwd",
  "equipments": [{"en": "some equipment", "category": "comfort"}],
  "simpleEquipments": ["4x4", "android-auto" ],
  "options": [{"es": "una option", "priceWithTaxes": 120}],
  "promotions": [{"id": "aaa", "en":"aaa"}],
  "doors":5,
  "gears":5,
  "seats":5,
  "cylinders":4,
  "power": { "ch": 123, "kw": 123 },
  "engineCapacity": { "cc": 1230 },
  "urbanCycleConsumption": {"ltPer100Km": 12,"kwhPer100Km": null},
  "extraUrbanCycleConsumption": {"ltPer100Km": 12,"kwhPer100Km": null},
  "combinedCycleConsumption": {"ltPer100Km": 12,"kwhPer100Km": null},
  "co2EmissionsNedc": { "gramsPerKm": 21 },
  "co2EmissionsWltp": { "gramsPerKm": null },
  "height": { "meters": 2 },
  "width": { "meters": 2 },
  "length": { "meters": 2 },
  "wheelbase": { "meters": 2 },
  "weight": { "kg": 1000 },
  "totalAuthorizedWeight": { "kg": 1000 },
  "minBootSpaceBackCapacity": {"lt": 120},
  "maxBootSpaceBackCapacity":{"lt": 120},
  "bootSpaceFrontCapacity":{"lt": 120},
  "maxSpeed":{"kmPerHour": 220},
  "electricRangeNedc":{ "km": null },
  "electricRangeWltp":{ "km": null },
  "electricBatteryWarrantyPeriod":{ "km": null, "years": null },
  "electricBatteryStateOfHealth":{ "percent": null },
  "electricBatteryCapacity":{"kwh": null},
  "electricBatteryType":null,
  "electricBatterySlowChargePower":{"kwh": null},
  "electricBatterySlowChargeTime":{"minutes": null},
  "electricBatteryMediumChargePower":{"kwh": null},
  "electricBatteryMediumChargeTime":{"minutes": null},
  "electricBatteryQuickChargePower":{"kwh": null},
  "electricBatteryQuickChargeTime":{"minutes": null},
  "electricBatteryCost":1230,
  "electricMaximumPowerCarElectricalOutlet":{ "kw": null },
  "electricMaximumPowerCarDirectCurrent":{ "amperes": 20 }
}
